"likes","views","title"
849,28000,Will healthcare embrace digital or will we die waiting?
848,28000,Why immigration prisons aren't the answer
843,28000,How I claimed a seat at the periodic table
842,28000,How artificial light affects our health
839,27000,Why our future relies on the genetic diversity of food
832,27000,The future of food
830,27000,Challenging the perception of belonging
828,27000,The ruralities of autism
827,27000,Why we need to move manufacturing off-planet
826,27000,Passion for compassion
824,27000,Can we protect AI from our biases?
818,27000,A poet's plea to save our planet
807,26000,"3 things I learned from my intellectually disabled son"
801,26000,How I built a first aid kit for astronauts
790,26000,Why animals in zoos need choice
784,26000,What we can learn from college athletes
782,26000,Humanity at the intersection of science and archaeology
775,25000,The future of reading. It's fast
772,25000,The historical significance of smell
766,25000,How darkness influences imagination
762,25000,America's most invisible communities — mobile home parks
757,25000,How an algorithm can fight election bias so every vote counts
756,25000,A vision of the future from IBM's most prolific inventor
746,24000,Lost in translation: The joy of a jargon-free world
742,24000,Brené Brown on What Vulnerability Isn't
739,24000,Nuestras mentiras en la vida y en los negocios
738,24000,Why millennials today hold more power than ever before
735,24000,The 4 superpowers of design
731,24000,Brené Brown
730,24000,The dark side of storytelling
727,24000,The case for restorative justice in juvenile courts
722,24000,Countdown Session 1: Urgency (Full session)
716,23000,The restorative potential of nature's beauty
713,23000,Can time be wasted?
708,23000,Why we need more (real) science in fiction
706,23000,My story of perseverance as a trans swimming champion
702,23000,What if we traded employees like football players?
690,23000,"""Big Yellow Taxi"" / ""Song for Sunshine"""
684,22000,Reimagining gender inclusivity in sports
677,22000,Why medieval politics was nothing like Game of Thrones
673,22000,Designing for justice
672,22000,The importance of visual literacy
662,22000,What if we used the problem as part of the solution?
659,21000,A millennial's unexpected secret to success
651,21000,Why we need to reclaim vanishing food cultures
644,21000,A holographic meeting platform for collaborating from anywhere
643,21000,The art of letting go...of the floor
633,21000,The benefits of using comedy to explain science
626,20000,How prefab homes can transform affordable housing
624,20000,Art and awe as healing
620,20000,Rediscovering heritage through dance
614,20000,Armchair archaeologist
613,20000,"Pollution-free lights, powered by microbes"
608,20000,The Big Pivot
607,20000,A super-strong plastic that reverts to dust
606,20000,"""A Ride With Polly Jean"" / ""Ali Farka Touche"""
605,20000,Why we need to stop stigmatizing mothers who do sex work
601,20000,¿A quién pertenece el pasado?
599,19000,An easy way to cook up innovation
598,19000,Por qué necesitamos proteger el alta mar
596,19000,A business against racism 
594,19000,How fiction can help us better understand our reality
592,19000,Thriving in an overconnected world
591,19000,How can we give our kids a brighter future?
583,19000,How do we stop the massive inequality dominating the world economy?
580,19000,"""You and I"" / ""Attention"""
579,19000,Community health heroes
578,19000,The office without a**holes
576,19000,How I bring myth and magic to life
565,18000,The importance of emotional tone in the digital age
561,18000,How better transportation can reinvigorate a city
557,18000,Cultural clashes in defining beauty
553,18000,Want a happier life? Be more compassionate
543,18000,The argument for trouble
533,17000,"Why the ""good immigrant"" is a bad narrative"
532,17000,The case for reforming STEM education
530,17000,A historical journey through loneliness
527,17000,Un ejército de mujeres 
511,17000,"When goods cross borders, armies stay home"
500,16000,The new sharing of emotions
497,16000,Take back control of your personal data
493,16000,Why your business needs dissenters
490,16000,How you can help solve cold cases
488,16000,"""What a Wonderful World"""
486,16000,Can we design cities for happiness?
483,16000,What female military leadership can teach us about overcoming self-doubt
480,16000,Can sharks help us fight cancer?
478,15000,Why we need to clean up our space debris
473,15000,The pioneering women who helped create modern computing
467,15000,Using happiness to evaluate a company's success
463,15000,"""Peaceful Afternoon"" / ""Going To A Town"""
462,15000,The ants that run the world
461,15000,Lessons from a former Air Force pilot on counterintuitive thinking
460,15000,The cost of failing to design accessibly
455,15000,Home is where the art is
452,15000,"Undocumented lives, inside out"
450,15000,Want to get ahead? Be paranoid
449,14000,How COVID-19 impacted a global tech company and spurred innovation
443,14000,Economics and art
438,14000,Cómo un doctor de astronautas capacita al cuerpo para el espacio
435,14000,Art that brings words to life
434,14000,We don't need immigration caps. We need minimums
432,14000,The upside of data
430,14000,"""The Singularity"""
428,14000,A new Netflix-style pricing model that could make medical treatments affordable for all
426,14000,The power of transformative collaboration
422,14000,What if we supported millions of African farmers in growing more food?
421,14000,"""AI therapy"""
417,13000,A solution for building a generation of inventors 
413,13000,The most precious commodity of all?
409,13000,How IBM's Watson is redefining the future of cooking
406,13000,Easy ways to practice empathy in your own life
403,13000,The ecology of inequality
401,13000,Lessons from a lifetime of bad advice
400,13000,How AR can make us feel more connected to the world
398,13000,Where are we trying to end up?
391,13000,What if we could address the unaddressable?
389,12000,Cómo usar el arte de la fotografía para restaurar la memoria
388,12000,How we'll predict the next refugee crisis
386,12000,Hablemos de la muerte con los niños | Alejandro Nespral | TEDxBariloche
385,12000,How blockchain and AI can help us decipher medicine's big data
384,12000,How we can bring AI personalities to life
383,12000,Why we must protect the digital rights of children
382,12000,The future of our coastal systems
378,12000,"""Chromatic"""
377,12000,A call for a moral revival
375,12000,What if the best fertilizer was an algorithm?
374,12000,"""Illusions for a better society"""
367,12000,"""Being Human"" / ""Awakening"""
366,12000,How I make paint from poison
363,12000,Easing water scarcity by understanding when and where it flows
362,12000,Tales of a Zimbabwean comedian
361,12000,A vision for truly secure and seamless transactions
360,12000,Feeding the future
359,11000,Three stories of Scotland
354,11000,Sound and sentiment
353,11000,Can credit scores be determined by cellphone data?
349,11000,The Trans Ban
347,11000,Can dogs sniff out malaria?
345,11000,The sky is not the limit — why investing in space still matters
344,11000,Countdown Session 5: Action (Full session)
342,11000,Human-centered justice
335,11000,What if our data could be protected online?
332,11000,It's time to write a new climate story
329,10000,The importance of queer allyship in the classroom
326,10000,Solar energy can help put power back in the hands of the people
323,10000,"8 steps to understanding information (and maybe the universe)"
322,10000,How I brought Batman to Hollywood (and academia)
320,10000,Using Aboriginal traditions to teach tech
318,10000,Are you technically fit to parent?
317,10000,How a company can nurture its internal rebels
316,10000,How businesses can plan for the road to recovery
315,10000,How to benefit from uncomfortable conversations
313,10000,Can 0.7% of corporate profits fund the world's biggest problems?
312,10000,One company at a time
307,10000,Strategies for fuel-efficient space travel
305,10000,Self-compassion for the self-critical
303,10000,How I bring imagined worlds to life
302,10000,"An open-source database to create ""guardian angel"" AI"
298,9900,Trash or historical artifact?
296,9800,¿Como será el cine del futuro?
295,9800,"How I leapt from a responsible ""no"" to an impassioned ""yes"""
293,9700,The beauty and power of algorithms
292,9700,Can we be friends with our AI?
289,9600,When will I get my water next?
288,9600,The enigmatic language of elephants
287,9500,"""Sleep Sleep Beauty Bright"""
283,9400,Investments in the future: A new approach to foreign aid
281,9300,"""Beautifully Out of Place"""
280,9300,Machines need an algorithm for humor. This is what it looks like
279,9300,Virtualizing employment in Saudi Arabia
276,9200,Theater healed my community after Hurricane Katrina
273,9100,The sounds and sights of tap dance
272,9000,Why we need to build robots we can trust
268,8900,"Tactile photographs that display worlds of light, shadow and mood"
267,8900,What birdspotting can teach us about conservation
265,8800,How complex global organizations are adapting to our new reality
264,8800,Countdown Session 2: Leadership (Full session)
263,8700,The case for vermicomposting
262,8700,"How organizations can create safe, inviting workplaces for returning employees"
261,8700,"""All Together Now"""
259,8600,Michael Tubbs on politics as a force for good
255,8500,Why we need to put politics in its place
254,8400,Do insects have personalities?
253,8400,Protecting privacy at Twitter
252,8400,The race to net-zero emissions by 2050 is on. Can we count you in?
250,8300,"From Beethoven to Kinect, linking music to our bodies"
249,8300,"""Meditation from Thais"""
248,8200,We need to help women close the retirement savings gap
246,8200,Passing the mic to migrant farmer workers
244,8100,A marriage of opposites: Krump meets Mozart
242,8000,"""It All Starts With One"" / ""You Light My Fire"""
241,8000,How a child's mess could help you rediscover your creativity 
239,7900,"""Follow the Sound"""
236,7800,The possibilities of human-centric lighting
233,7700,How I hunt natural gas leaks with Google Street View cars
232,7700,"Finally, tech solutions to economic development"
230,7600,A data translation toolkit that anyone can use
229,7600,My quest to sleep in every former slave dwelling in the US
228,7600,Can a teddybear change how children relate to their own disease?
227,7500,Collective cooperation in the social sector
223,7400,Investing in health care workers strengthens communities
222,7400,From flesh eating bacteria to molecular superglue
221,7300,How jiu jitsu taught me to be a better employee
220,7300,The mind-body problem of scientific discovery
219,7300,How technology can democratize music
218,7200,Por qué deberíamos comer más bichos
214,7100,Can climate change ever be funny? 17 comedians try to answer
212,7000,A makerspace for everyone
210,7000,Beats that break barriers
209,6900,My ghost town road trip
208,6900,The joys of amateur aviation
206,6800,The microbes in our food can save lives
205,6800,What businesses can learn from refugee communities
202,6700,Macro-portraits of microscopic insects
199,6600,A mathematical model for predicting Parkinson's
197,6500,"Chips, conflict and the Congo"
196,6500,A story of Brazil through a single iconic building
190,6300,A library of minds
188,6200,The corporation as agent of cultural fusion
187,6200,How a world-record mountaineer empowers youth to overcome fear
186,6200,"""I Can See Clearly Now"""
185,6100,What if we digitally empowered community health workers?
184,6100,"""The Rich Man's House"" / ""Woke Up This Morning (With My Mind Stayed on Freedom)"""
183,6100,Democratizing investing
182,6000,Countdown Session 3: Transformation (Full session)
181,6000,Relief to recovery
179,5900,"""King of the World"" / ""Nothing Has to Be True"" / ""My Silver Lining"""
178,5900,"""Fearless"""
176,5800,Could Moby Dick prevent the next financial crisis?
175,5800,Designing materials one atom at a time
174,5800,We are not mud 
172,5700,The case for AR and VR in activism
171,5700,"""The Coming Out Beauty"" / ""419 sq ft"""
167,5500,Let's build better digital tools for our cities!
163,5400,Countdown Session 4: Transformation (Full session)
161,5300,"""The [Uncertain] Four Seasons"""
159,5300,A tribute to West Virginia coal miners
157,5200,Weaving a strong smart grid
154,5100,Using corporate data to improve our lives
152,5000,Bring out your inner filmmaker
151,5000,Visualizing climate change through space and time
150,5000,"An excerpt from ""Figuring"""
148,4900,A grassroots healthcare revolution in Africa
147,4900,"5 keys to shifting to a well-being economy — and the cost of inaction"
143,4700,"Entropy, order and the theory of the multiverse"
142,4700,Using the Super Bowl to give back
141,4700,"""Wrong"" / ""Small Town Weirdos"""
139,4600,Et si la bière était féminine ? | Elisabeth Pierre | TEDxToulouse
138,4600,Lessons from Utah's legacy of women's suffrage
137,4500,Finding music in mundanity
135,4500,A vibrant dance performance of funk classics
131,4300,How one city became a music capital
130,4300,Are our cultural narratives killing sharks?
123,4100,"""Taranta"" / ""Calblanque""	"
122,4000,"""Not About Me"""
120,4000,Africans should lead on health care solutions for Africa
119,3900,"""Drottning Kristina"""
117,3900,Rethinking education and celebrating the Arabic language
115,3800,"""Your Song"" / ""Real Life"""
114,3800,To the beat of light
111,3700,Why we need to design cameras for robots
108,3600,"""Circular Escape"""
107,3500,Solving the sanitation crisis
102,3400,"""Home to Oakland"" and ""Walk Away"""
98,3200,"""The Muse"" / ""Spring Song"""
97,3200,"""Neghmat Erriah"" / ""Ghounia"""
95,3100,"Can we ""print"" smart objects?"
94,3100,What scorpions can teach us about brain tumors
93,3100,How we're tracking medical donations across the world
91,3000,"""Back on My Feet"""
89,2900,Nuestro imperativo moral para actuar sobre el cambio climático — y 3 pasos que podemos dar
88,2900,"""Distance"" / ""Sides"""
85,2800,"""Ruiseñor"" / ""No Hay Vuelta Atrás"""
79,2600,"""San Francisco"""
76,2500,"""Astral Plane"""
75,2500,A game that lets you decide how to tackle the climate crisis
74,2400,The revolutionary power of Black joy
72,2400,Cement's carbon problem — and 2 ways to fix it
68,2200,Facing the future together
65,2100,A chef shares: Here's how we can feed the planet without hurting the climate 
49,1600,"""Dive In"""
47,1500,The case for public media
40,1300,"""Jamie Raeburn"" / ""Baloo Baleerie"" / ""Twa recruitin Sergeants"""
39,1300,Virtual Worlds
37,1200,Post-Pandemic Paradise in Rapa Nui
15,532,Year In Ideas 2015
